{
  "communityId": "00000000-0000-4000-8000-000000000000",
  "communityName": "Lugaggia Innovation Community",
  "communityType": "CollectiveSelfConsumption",
  "legalStructure": "ZEV (Zusammenschluss zum Eigenverbrauch)",
  "communityOperatorId": "00000000-0000-4000-8000-000000000000",
  "country": "CH",
  "latitude": 0.0,
  "longitude": 0.0,
  "gridConnectionVoltageLevel": 0.0,
  "currency": "CHF",
  "marketMechanism": "<marketMechanism>",
  "co2EmissionFactor": 0.0,
  "yearEstablished": 0,
  "validFrom": "2026-07-20T09:00:00+02:00",
  "validUntil": "2026-07-20T09:00:00+02:00",
  "operationalRole": "Primary"
}
